Artist,Song,Days in top10,Peak,Days on peak,Days,PkStreams,Total,listeners,playcount,rank,track_url,artist_url,duration_min,duration,genre,genre_description,artist_listeners,artist_playcount,AvgPerDay,Avg_log10,Days_bonus,Peak_bonus,Score,Score_norm
The Weeknd,Blinding Lights,446.0,1,82,2169,8453567,5037607641,2221161,36470257,52,https://www.last.fm/music/The+Weeknd/_/Blinding+Lights,https://www.last.fm/music/The+Weeknd,3.333333333333333,3 мин 20 сек,r&b,"R&B is a musical genre that began to develop as a distinct style in the early 1950s. Originally known as rhythm and blues, it was primarily created by African American musicians and drew influence from both blues and early rock 'n' roll, with significant interaction between these genres. Over time, musicians from different backgrounds adopted the style and introduced new elements. In the 1950s, artists like Muddy Waters contributed to shaping the genre by emphasizing faster melodies and energetic rhythms",5050479,1031011466,103092,5.013229177751209,2.9190780923760737,1.995,29.194844892343976,0.8926245760699753
Harry Styles,As It Was,426.0,1,81,1272,16103849,3999274385,1867858,39479081,39,https://www.last.fm/music/Harry+Styles/_/As+It+Was,https://www.last.fm/music/Harry+Styles,2.75,2 мин 45 сек,pop,"Pop music is a broad-term for many different types of music: The term is flexible, and the music labeled ""pop"" changes frequently. It usually refers to popular, appealing and mostly mainstream music with emphasis on catchy melodies and an accessible style, with songs that tend to have a short to medium length. Some subgenres may include synthpop, electropop, bubblegum, sophisti-pop, hyperpop and many others.",3037938,381185399,198812,5.298444778671334,2.9138138523837167,1.995,30.800170175404503,0.9577356513794689
Post Malone,Sunflower - Spider-Man: Into the Spider-Verse,213.0,1,16,2263,5033261,3554729660,1659244,24440448,214,https://www.last.fm/music/Post+Malone/_/Sunflower+-+Spider-Man:+Into+the+Spider-Verse,https://www.last.fm/music/Post+Malone,2.6166666666666667,2 мин 37 сек,rap,"Rap is a vocal style, usually coming together with hip-hop, the musical genre off-shoot of the hip hop culture. Rapping itself, also known as emceeing, MCing, spitting, or just rhyming, is the rhythmic spoken delivery of rhymes and wordplay. Rapping is one of the four pillars of the hip hop culture, along with DJing, graffiti, and breaking.

Rap is also considered a separate genre from hip hop in some cases where the artists do not make music compatible with the hip hop culture.",3354307,312638678,314578,5.497729727541794,2.230448921378274,1.995,24.46349865494561,0.7007238787912173
The Neighbourhood,Sweater Weather,0.0,12,1,1988,3342205,3532412627,2750909,45328300,29,https://www.last.fm/music/The+Neighbourhood/_/Sweater+Weather,https://www.last.fm/music/The+Neighbourhood,4.0,4 мин,indie,"The term 'indie' is best known as being an abbreviation for the word 'independent'. This term is used to differentiate between bands that were/are on a major record label and those that weren't. Indie is not a genre of music, and is only a term for bands on independent labels.",3711268,351516624,3342205,6.524033214529873,1.3010299956639813,1.94,16.466648035334252,0.3763761914866161
The Weeknd,Starboy,145.0,1,40,1963,5125218,3385509594,2172688,30761205,96,https://www.last.fm/music/The+Weeknd/_/Starboy,https://www.last.fm/music/The+Weeknd,3.85,3 мин 51 сек,r&b,"R&B is a musical genre that began to develop as a distinct style in the early 1950s. Originally known as rhythm and blues, it was primarily created by African American musicians and drew influence from both blues and early rock 'n' roll, with significant interaction between these genres. Over time, musicians from different backgrounds adopted the style and introduced new elements. In the 1950s, artists like Muddy Waters contributed to shaping the genre by emphasizing faster melodies and energetic rhythms",5050479,1031011466,128130,5.1076542156164555,2.6127838567197355,1.995,26.623666978137013,0.7883390704639912
Billie Eilish,BIRDS OF A FEATHER,477.0,1,25,542,10082989,3155270260,2047101,50373144,24,https://www.last.fm/music/Billie+Eilish/_/BIRDS+OF+A+FEATHER,https://www.last.fm/music/Billie+Eilish,3.5,3 мин 30 сек,pop,"Pop music is a broad-term for many different types of music: The term is flexible, and the music labeled ""pop"" changes frequently. It usually refers to popular, appealing and mostly mainstream music with emphasis on catchy melodies and an accessible style, with songs that tend to have a short to medium length. Some subgenres may include synthpop, electropop, bubblegum, sophisti-pop, hyperpop and many others.",3989143,768279522,403319,5.605649758517102,2.414973347970818,1.995,27.00730205593132,0.8038990897978964
Lady Gaga,Die With A Smile,406.0,1,201,451,11621474,3086803666,1619473,28213934,126,https://www.last.fm/music/Lady+Gaga/_/Die+with+a+Smile,https://www.last.fm/music/Lady+Gaga,4.2,4 мин 12 сек,pop,"Pop music is a broad-term for many different types of music: The term is flexible, and the music labeled ""pop"" changes frequently. It usually refers to popular, appealing and mostly mainstream music with emphasis on catchy melodies and an accessible style, with songs that tend to have a short to medium length. Some subgenres may include synthpop, electropop, bubblegum, sophisti-pop, hyperpop and many others.",7435460,963915459,57818,4.762070576123336,3.305351369446624,1.995,31.401931417880533,0.9821427431948377
Glass Animals,Heat Waves,258.0,1,65,1358,5003951,3000920519,1429347,22410749,295,https://www.last.fm/music/Glass+Animals/_/Heat+Waves,https://www.last.fm/music/Glass+Animals,3.966666666666667,3 мин 58 сек,electronic,"Electronic music refers to music that emphasizes the use of electronic musical instruments or electronic music technology as a central aspect of the sound of the music. Historically, electronic music was considered to be any music created with the use of electronic musical instruments or electronic processing, but in modern times, that distinction has been lost because almost all recorded music today, and the majority of live music performances, depend on extensive use of electronics.",2474614,126824068,76983,4.886400472786059,2.8195439355418688,1.995,27.485954535247345,0.8233129605919854
Drake,One Dance,187.0,1,101,2003,7196287,2888284842,1762093,19903405,403,https://www.last.fm/music/Drake/_/One+Dance,https://www.last.fm/music/Drake,2.9,2 мин 54 сек,hip hop,"Hip hop is a musical genre which developed alongside hip hop culture, defined by key stylistic elements such as rapping, DJing, sampling, scratching and beatboxing. Hip hop began in the Bronx in New York City in the 1970s, primarily among African Americans and Jamaican Americans, with some Latino influences.

The term rap is often used synonymously with hip hop, but hip hop denotes the practices of an entire subculture. Hip hop arose when DJs began isolating the percussion break from funk or disco songs for audiences to dance to.",6480644,1052429419,71250,4.852790963998923,3.0086001717619175,1.995,29.127214916984624,0.8898815429506022
Tom Odell,Another Love,0.0,11,1,1668,3052832,2856685034,1364806,17214444,564,https://www.last.fm/music/Tom+Odell/_/Another+Love,https://www.last.fm/music/Tom+Odell,4.066666666666666,4 мин 04 сек,indie,"The term 'indie' is best known as being an abbreviation for the word 'independent'. This term is used to differentiate between bands that were/are on a major record label and those that weren't. Indie is not a genre of music, and is only a term for bands on independent labels.",1930332,46708726,3052832,6.4847030476127205,1.3010299956639813,1.9449999999999998,16.409562731050087,0.3740608441949909
Coldplay,Yellow,0.0,15,1,1777,3078369,2656120736,3409308,36692225,51,https://www.last.fm/music/Coldplay/_/Yellow,https://www.last.fm/music/Coldplay,4.483333333333333,4 мин 29 сек,rock,"Rock music is a form of popular music with a prominent vocal melody, accompanied by guitar, drums, and bass. Many styles of rock music also use keyboard instruments such as organ, piano, mellotron, and synthesizers. Other instruments sometimes utilized in rock include saxophone, harmonica, violin, flute, French horn, banjo, melodica, and timpani. Also, less common stringed instruments such as mandolin and sitar are used. Rock music usually has a strong back beat",8825284,753851378,3078369,6.488320817997421,1.3010299956639813,1.925,16.24988751098348,0.36758450859589303
Taylor Swift,Cruel Summer,257.0,2,18,976,5405688,2654773625,1611779,47213782,26,https://www.last.fm/music/Taylor+Swift/_/Cruel+Summer,https://www.last.fm/music/Taylor+Swift,2.966666666666667,2 мин 58 сек,country,"Country music is a broad term, covering a great many styles of music predominantly created in the southern United States of America - however there are growing traditions of country music elsewhere, particularly in Canada and Australia.

Country music is generally characterized by its use of the guitar and its heavily-accented vocals describing life's hardships. A common joke runs that if one plays a country song backwards, the singer's child recovers from an illness",5681241,3437552088,300316,5.477579916938322,2.278753600952829,1.99,24.839289370857898,0.7159657352937981
Sabrina Carpenter,Espresso,224.0,1,32,577,11692253,2594356908,2005282,50843201,23,https://www.last.fm/music/Sabrina+Carpenter/_/Espresso,https://www.last.fm/music/Sabrina+Carpenter,2.9166666666666665,2 мин 55 сек,pop,"Pop music is a broad-term for many different types of music: The term is flexible, and the music labeled ""pop"" changes frequently. It usually refers to popular, appealing and mostly mainstream music with emphasis on catchy melodies and an accessible style, with songs that tend to have a short to medium length. Some subgenres may include synthpop, electropop, bubblegum, sophisti-pop, hyperpop and many others.",2983902,547170223,365382,5.562748337275023,2.5185139398778875,1.995,27.949669166762074,0.8421209608230086
Benson Boone,Beautiful Things,218.0,1,35,661,9256894,2554181027,874520,9061291,1296,https://www.last.fm/music/Benson+Boone/_/Beautiful+Things,https://www.last.fm/music/Benson+Boone,3.0,3 мин,pop,"Pop music is a broad-term for many different types of music: The term is flexible, and the music labeled ""pop"" changes frequently. It usually refers to popular, appealing and mostly mainstream music with emphasis on catchy melodies and an accessible style, with songs that tend to have a short to medium length. Some subgenres may include synthpop, electropop, bubblegum, sophisti-pop, hyperpop and many others.",1362525,40206493,264482,5.422397762407259,2.5563025007672873,1.995,27.653271475592256,0.8300992399948626
Vance Joy,Riptide,0.0,16,1,2456,2526786,2465077925,1975750,22114833,306,https://www.last.fm/music/Vance+Joy/_/Riptide,https://www.last.fm/music/Vance+Joy,3.3833333333333333,3 мин 23 сек,folk,"Folk music can have a number of different meanings, including:

Traditional music: The original meaning of the term ""folk music"" was synonymous with the term ""Traditional music"", also often including Roots music; the term ""Traditional music"" was given its more specific meaning to distinguish it from the other definitions that ""Folk music"" is now considered to encompass.
Folk music can also describe a particular kind of popular music which is based on traditional music.",2314548,47274524,2526786,6.402568633837817,1.3010299956639813,1.92,15.993472976487087,0.3571844817339141
The Chainsmokers,Something Just Like This,86.0,2,14,1977,4937390,2425215152,1132064,9857857,1210,https://www.last.fm/music/The+Chainsmokers/_/Something+Just+Like+This,https://www.last.fm/music/The+Chainsmokers,4.116666666666666,4 мин 07 сек,electronic,"Electronic music refers to music that emphasizes the use of electronic musical instruments or electronic music technology as a central aspect of the sound of the music. Historically, electronic music was considered to be any music created with the use of electronic musical instruments or electronic processing, but in modern times, that distinction has been lost because almost all recorded music today, and the majority of live music performances, depend on extensive use of electronics.",2618245,82171145,352670,5.547369749268332,2.1760912590556813,1.99,24.02244981604412,0.6828351901448073
The Weeknd,Die For You,2.0,9,1,1408,3554197,2418344029,1855834,31029227,90,https://www.last.fm/music/The+Weeknd/_/Die+for+You,https://www.last.fm/music/The+Weeknd,4.333333333333333,4 мин 20 сек,r&b,"R&B is a musical genre that began to develop as a distinct style in the early 1950s. Originally known as rhythm and blues, it was primarily created by African American musicians and drew influence from both blues and early rock 'n' roll, with significant interaction between these genres. Over time, musicians from different backgrounds adopted the style and introduced new elements. In the 1950s, artists like Muddy Waters contributed to shaping the genre by emphasizing faster melodies and energetic rhythms",5050479,1031011466,3554197,6.550741618154754,1.3010299956639813,1.955,16.661900667869617,0.38429552658682065
SZA,Kill Bill,174.0,1,20,848,8455200,2414898521,2065761,42479453,33,https://www.last.fm/music/SZA/_/Kill+Bill,https://www.last.fm/music/SZA,2.566666666666667,2 мин 34 сек,r&b,"R&B is a musical genre that began to develop as a distinct style in the early 1950s. Originally known as rhythm and blues, it was primarily created by African American musicians and drew influence from both blues and early rock 'n' roll, with significant interaction between these genres. Over time, musicians from different backgrounds adopted the style and introduced new elements. In the 1950s, artists like Muddy Waters contributed to shaping the genre by emphasizing faster melodies and energetic rhythms",3316727,546918064,422760,5.626094916511411,2.3222192947339195,1.995,26.0647272074088,0.7656687930508225
Lord Huron,The Night We Met,0.0,15,1,1196,3221586,2226242952,1704271,28552931,123,https://www.last.fm/music/Lord+Huron/_/The+Night+We+Met,https://www.last.fm/music/Lord+Huron,3.466666666666667,3 мин 28 сек,folk,"Folk music can have a number of different meanings, including:

Traditional music: The original meaning of the term ""folk music"" was synonymous with the term ""Traditional music"", also often including Roots music; the term ""Traditional music"" was given its more specific meaning to distinguish it from the other definitions that ""Folk music"" is now considered to encompass.
Folk music can also describe a particular kind of popular music which is based on traditional music.",2174011,66499290,3221586,6.5080698641038275,1.3010299956639813,1.925,16.29934865612109,0.36959062435319856
OneRepublic,Counting Stars,0.0,31,1,2371,1717699,2201686041,1883795,18728891,466,https://www.last.fm/music/OneRepublic/_/Counting+Stars,https://www.last.fm/music/OneRepublic,4.283333333333333,4 мин 17 сек,rock,"Rock music is a form of popular music with a prominent vocal melody, accompanied by guitar, drums, and bass. Many styles of rock music also use keyboard instruments such as organ, piano, mellotron, and synthesizers. Other instruments sometimes utilized in rock include saxophone, harmonica, violin, flute, French horn, banjo, melodica, and timpani. Also, less common stringed instruments such as mandolin and sitar are used. Rock music usually has a strong back beat",4170125,129952208,1717699,6.234947315652686,1.3010299956639813,1.845,14.96636966884497,0.3155257590312988
The Chainsmokers,Closer,191.0,1,82,1696,6875523,2123412841,1247970,10367000,1152,https://www.last.fm/music/The+Chainsmokers/_/Closer,https://www.last.fm/music/The+Chainsmokers,4.083333333333333,4 мин 05 сек,electronic,"Electronic music refers to music that emphasizes the use of electronic musical instruments or electronic music technology as a central aspect of the sound of the music. Historically, electronic music was considered to be any music created with the use of electronic musical instruments or electronic processing, but in modern times, that distinction has been lost because almost all recorded music today, and the majority of live music performances, depend on extensive use of electronics.",2618245,82171145,83847,4.9234927079758215,2.9190780923760737,1.995,28.672259105142015,0.8714287954358425
Dua Lipa,Don't Start Now,235.0,2,7,1152,6100930,2095889464,1468778,22889493,278,https://www.last.fm/music/Dua+Lipa/_/Don%27t+Start+Now,https://www.last.fm/music/Dua+Lipa,3.05,3 мин 03 сек,pop,"Pop music is a broad-term for many different types of music: The term is flexible, and the music labeled ""pop"" changes frequently. It usually refers to popular, appealing and mostly mainstream music with emphasis on catchy melodies and an accessible style, with songs that tend to have a short to medium length. Some subgenres may include synthpop, electropop, bubblegum, sophisti-pop, hyperpop and many others.",3101130,300824016,871561,5.940298286799005,1.9030899869919435,1.99,22.49679515681164,0.6209555097698858
Teddy Swims,Lose Control,57.0,5,1,725,5154184,2074907379,771539,6821573,1484,https://www.last.fm/music/Teddy+Swims/_/Lose+Control,https://www.last.fm/music/Teddy+Swims,3.5,3 мин 30 сек,soul,"Soul music is a music genre that combines rhythm and blues and gospel music, originating in the United States.  According to the Rock and Roll Hall of Fame, soul is ""music that arose out of the black experience in America through the transmutation of gospel and rhythm & blues into a form of funky, secular testifying."" The genre occasionally uses improvisational additions, twirls and auxiliary sounds. Catchy rhythms, stressed by handclaps and plastic body moves, are an important feature.",1039878,18130590,5154184,6.71216000269708,1.3010299956639813,1.975,17.247124960929735,0.40803188919224653
Hozier,Take Me To Church,139.0,1,30,2150,2140282,2066325400,2095590,26160975,168,https://www.last.fm/music/Hozier/_/Take+Me+to+Church,https://www.last.fm/music/Hozier,4.05,4 мин 03 сек,blues,"Blues is a vocal and instrumental form of music based on the use of ""blue notes."" It emerged in Black communities of the United States from spirituals, work songs, field hollers, shouts and chants, and rhymed simple narrative ballads. The use of blue notes and the prominence of call-and-response patterns in the music and lyrics are indicative of African influence. 

""Blue notes,"" also known as ""worried notes,"" are the typically flattened third, fifth, and seventh degrees in a major scale.",3180555,259757367,71342,4.853351367632724,2.4913616938342726,1.995,24.122450099656504,0.6868911444526118
ROSÉ,APT.,251.0,1,28,388,14596132,2048147692,1250895,24787412,208,https://www.last.fm/music/Ros%C3%A9/_/APT.,https://www.last.fm/music/Ros%C3%A9,2.816666666666667,2 мин 49 сек,pop,"Pop music is a broad-term for many different types of music: The term is flexible, and the music labeled ""pop"" changes frequently. It usually refers to popular, appealing and mostly mainstream music with emphasis on catchy melodies and an accessible style, with songs that tend to have a short to medium length. Some subgenres may include synthpop, electropop, bubblegum, sophisti-pop, hyperpop and many others.",1543726,94413697,521290,5.717080226971757,2.462397997898956,1.995,28.085065174922313,0.8476125454737649
Jimin,Who,188.0,1,20,479,10674703,2042607289,398100,195455424,2,https://www.last.fm/music/Jimin/_/Who,https://www.last.fm/music/Jimin,2.833333333333333,2 мин 50 сек,k-pop,"K-pop means Korean pop, which is a musical genre, sometimes described more as an umbrella term, consisting of different music styles, including hip-hop, rap, jazz, r&b, dance, rock music and ballads. The name for the genre is first recorded in English around 1990–95. Strongly influenced by Western popular music, K-pop took off in 1992 with Seo Taiji and Boys, who incorporated rap, rock, and dance elements into Korean popular music.
Modern K-pop ""idol"" culture began later in the 1990s, as K-pop idol music grew into a subculture.",802534,731046222,533735,5.72732649655301,2.3222192947339195,1.995,26.53371565458476,0.7846906962286877
Arctic Monkeys,505,0.0,40,1,1407,1987531,2027435345,2806962,52423060,21,https://www.last.fm/music/Arctic+Monkeys/_/505,https://www.last.fm/music/Arctic+Monkeys,5.083333333333333,5 мин 05 сек,indie rock,"Indie rock is a vague term used to identify rock artists that are or were unsigned, or have signed to small record labels, rather than major record labels.",6834211,882703772,1987531,6.298314129686517,1.3010299956639813,1.8,14.749732088705594,0.30673906268747153
Tate McRae,greedy,206.0,1,34,742,6282050,1965178147,1189535,21954429,314,https://www.last.fm/music/Tate+McRae/_/greedy,https://www.last.fm/music/Tate+McRae,2.183333333333333,2 мин 11 сек,pop,"Pop music is a broad-term for many different types of music: The term is flexible, and the music labeled ""pop"" changes frequently. It usually refers to popular, appealing and mostly mainstream music with emphasis on catchy melodies and an accessible style, with songs that tend to have a short to medium length. Some subgenres may include synthpop, electropop, bubblegum, sophisti-pop, hyperpop and many others.",2071651,221947016,184766,5.266624407372872,2.5440680443502757,1.995,26.730308458503103,0.7926643879136701
The Police,Every Breath You Take,0.0,21,1,1487,2511962,1958048139,2557491,22434763,293,https://www.last.fm/music/The+Police/_/Every+Breath+You+Take,https://www.last.fm/music/The+Police,4.233333333333333,4 мин 14 сек,rock,"Rock music is a form of popular music with a prominent vocal melody, accompanied by guitar, drums, and bass. Many styles of rock music also use keyboard instruments such as organ, piano, mellotron, and synthesizers. Other instruments sometimes utilized in rock include saxophone, harmonica, violin, flute, French horn, banjo, melodica, and timpani. Also, less common stringed instruments such as mandolin and sitar are used. Rock music usually has a strong back beat",4320426,102623887,2511962,6.400013238164612,1.3010299956639813,1.895,15.77892442547009,0.34848251521646295
Travis Scott,goosebumps,1.0,10,1,1954,3297928,1919311891,1604870,22020348,312,https://www.last.fm/music/Travis+Scott/_/goosebumps,https://www.last.fm/music/Travis+Scott,4.05,4 мин 03 сек,rap,"Rap is a vocal style, usually coming together with hip-hop, the musical genre off-shoot of the hip hop culture. Rapping itself, also known as emceeing, MCing, spitting, or just rhyming, is the rhythmic spoken delivery of rhymes and wordplay. Rapping is one of the four pillars of the hip hop culture, along with DJing, graffiti, and breaking.

Rap is also considered a separate genre from hip hop in some cases where the artists do not make music compatible with the hip hop culture.",186496,11673244,3297928,6.5182413016298675,1.3010299956639813,1.95,16.536833532172764,0.3792228750955444
Juice WRLD,Lucid Dreams,110.0,2,6,1426,5544528,1896783804,1201301,17248490,561,https://www.last.fm/music/Juice+WRLD/_/Lucid+Dreams,https://www.last.fm/music/Juice+WRLD,3.983333333333333,3 мин 59 сек,rap,"Rap is a vocal style, usually coming together with hip-hop, the musical genre off-shoot of the hip hop culture. Rapping itself, also known as emceeing, MCing, spitting, or just rhyming, is the rhythmic spoken delivery of rhymes and wordplay. Rapping is one of the four pillars of the hip hop culture, along with DJing, graffiti, and breaking.

Rap is also considered a separate genre from hip hop in some cases where the artists do not make music compatible with the hip hop culture.",2340697,483664304,924088,5.965713800600531,1.845098040014257,1.99,21.904580413140344,0.5969356184858834
Coldplay,Viva La Vida,0.0,27,1,1199,2811786,1889039224,3381953,39130412,40,https://www.last.fm/music/Coldplay/_/Viva+la+Vida,https://www.last.fm/music/Coldplay,4.033333333333333,4 мин 02 сек,rock,"Rock music is a form of popular music with a prominent vocal melody, accompanied by guitar, drums, and bass. Many styles of rock music also use keyboard instruments such as organ, piano, mellotron, and synthesizers. Other instruments sometimes utilized in rock include saxophone, harmonica, violin, flute, French horn, banjo, melodica, and timpani. Also, less common stringed instruments such as mandolin and sitar are used. Rock music usually has a strong back beat",8825284,753851378,2811786,6.4489824186848095,1.3010299956639813,1.865,15.647945994727667,0.3431701049791244
Post Malone,Circles,131.0,1,3,1187,7292777,1887977040,1421900,20525938,370,https://www.last.fm/music/Post+Malone/_/Circles,https://www.last.fm/music/Post+Malone,3.583333333333333,3 мин 35 сек,rap,"Rap is a vocal style, usually coming together with hip-hop, the musical genre off-shoot of the hip hop culture. Rapping itself, also known as emceeing, MCing, spitting, or just rhyming, is the rhythmic spoken delivery of rhymes and wordplay. Rapping is one of the four pillars of the hip hop culture, along with DJing, graffiti, and breaking.

Rap is also considered a separate genre from hip hop in some cases where the artists do not make music compatible with the hip hop culture.",3354307,312638678,2430925,6.38577173865378,1.6020599913279625,1.995,20.4096268854188,0.5363011584454253
